{
  "id": "salon_crawler",
  "cellM": 0.25,
  "boundsMinM": [-4.2, -0.8, -3.2],
  "boundsMaxM": [4.9, 2.5, 3],
  "colliders": [
    {
      "id": "coffee_table",
      "centerM": [0.5, 0.225, -0.6],
      "halfExtentsM": [0.6, 0.225, 0.3]
    },
    {
      "id": "counter",
      "centerM": [-3.6, 0.45, -1.8],
      "halfExtentsM": [0.4, 0.45, 0.8]
    },
    {
      "id": "side_table",
      "centerM": [-1.3, 0.3, -1.2],
      "halfExtentsM": [0.25, 0.3, 0.25]
    },
    {
      "id": "sofa",
      "centerM": [0.5, 0.45, -1.75],
      "halfExtentsM": [1.1, 0.45, 0.45]
    },
    {
      "id": "stairs",
      "centerM": [3.7, 0.15, -1.25],
      "halfExtentsM": [0.3, 0.15, 0.75]
    },
    {
      "id": "wall_back",
      "centerM": [0, 1.25, -3.1],
      "halfExtentsM": [4.2, 1.25, 0.1]
    },
    {
      "id": "wall_side",
      "centerM": [-4.1, 1.25, 0],
      "halfExtentsM": [0.1, 1.25, 3]
    }
  ],
  "nav": {
    "originM": [-4, -3],
    "cols": 32,
    "rowCount": 24,
    "rows": [
      "11111111111111111111111111111111",
      "11111111111111111111111111111111",
      "00011111111111111111111111111111",
      "00011111111111000000001111111111",
      "00011111111111000000001111111100",
      "00011111111111000000001111111100",
      "00011111110011000000001111111100",
      "00011111110011111111111111111100",
      "11111111111111110000111111111100",
      "11111111111111110000111111111100",
      "11111111111111110000111111111111",
      "11111111111111111111111111111111",
      "11111111111111111111111111111111",
      "11111111111111111111111111111111",
      "11111111111111111111111111111111",
      "11111111111111111111111111111111",
      "11111111111111111111111111111111",
      "11111111111111111111111111111111",
      "11111111111111111111111111111111",
      "11111111111111111111111111111111",
      "11111111111111111111111111111111",
      "11111111111111111111111111111111",
      "11111111111111111111111111111111",
      "11111111111111111111111111111111"
    ]
  },
  "anchors": [
    {
      "id": "baby_spawn",
      "positionM": [-0.5, 0, 1.2]
    },
    {
      "id": "coffee_machine",
      "positionM": [-3.6, 1.05, -2]
    },
    {
      "id": "coffee_table",
      "positionM": [0.5, 0.45, -0.6]
    },
    {
      "id": "door",
      "positionM": [2.9, 0, -2.8]
    },
    {
      "id": "outlet_01",
      "positionM": [-3.95, 0.3, 0.5]
    },
    {
      "id": "papa_spawn",
      "positionM": [2.5, 0, 1.5]
    },
    {
      "id": "phone",
      "positionM": [-1.3, 0.65, -1.2]
    },
    {
      "id": "stairs_top",
      "positionM": [3.9, 0, -1.25]
    }
  ],
  "zones": [
    {
      "id": "behind_sofa",
      "kind": "hidden",
      "centerM": [0.5, 0.5, -2.6],
      "halfExtentsM": [1.1, 0.5, 0.4]
    }
  ],
  "props": [
    {
      "id": "mug_01",
      "kind": "mug",
      "centerM": [0.7, 0.5, -0.6],
      "halfExtentsM": [0.05, 0.05, 0.05]
    },
    {
      "id": "vase_01",
      "kind": "vase",
      "centerM": [1.3, 0.15, -0.6],
      "halfExtentsM": [0.08, 0.15, 0.08]
    }
  ]
}
